doc_id,doc_name,alt_id,alt_name,doc_session,doc_type,doc_area_major,doc_area_minor,doc_description,doc_url,is_current_session
12hjr00VV,HJR VV of 2012,NA,NA,2011-2012,HJR,Constitutional amendments,state,"Constitutional amendments; state; right to engage in modern farming and ranching; provide for. Amends the state constitution by adding sec. 28 to art. I.

Last Action: printed joint resolution filed 06/06/2012",https://www.legislature.mi.gov/Bills/Bill?ObjectName=2012-HJR-VV,FALSE
12hjr00WW,HJR WW of 2012,NA,NA,2011-2012,HJR,Constitutional amendments,state,Constitutional amendments; state; laws abridging the right of farmers and ranchers to employ technology and modern practices; prohibit. Amends the state constitution by adding sec. 29 to art. I.Last Action: printed joint resolution filed 06/06/2012,https://www.legislature.mi.gov/Bills/Bill?ObjectName=2012-HJR-WW,FALSE
12hjr00XX,HJR XX of 2012,NA,NA,2011-2012,HJR,Public utilities,other,"Public utilities; other; sale or lease of certain assets owned by public authority; prohibit unless approved by a majority of electors within the municipality. Amends sec. 25, art. VII of the state constitution.Last Action: printed joint resolution filed 06/15/2012",https://www.legislature.mi.gov/Bills/Bill?ObjectName=2012-HJR-XX,FALSE
12hjr00YY,HJR YY of 2012,NA,NA,2011-2012,HJR,Labor,collective bargaining,Labor; collective bargaining; right to collective bargaining; amend constitution to provide right. Amends the state constitution by adding sec. 28 to art. I.Last Action: printed joint resolution filed 06/15/2012,https://www.legislature.mi.gov/Bills/Bill?ObjectName=2012-HJR-YY,FALSE
12hjr00ZZ,HJR ZZ of 2012,NA,NA,2011-2012,HJR,Higher education,state universities,"Higher education; state universities; African-American university; create. Amends sec. 6, art. VIII of the state constitution.Last Action: printed joint resolution filed 06/15/2012",https://www.legislature.mi.gov/Bills/Bill?ObjectName=2012-HJR-ZZ,FALSE
12hjr0AAA,HJR AAA of 2012,NA,NA,2011-2012,HJR,Elections,candidates,"Elections; candidates; residency requirement for state senate and state representative candidates; modify. Amends sec. 7, art. IV of the state constitution.Last Action: printed joint resolution filed 09/12/2012",https://www.legislature.mi.gov/Bills/Bill?ObjectName=2012-HJR-AAA,FALSE
12hjr0BBB,HJR BBB of 2012,NA,NA,2011-2012,HJR,Legislature,legislators,"Legislature; legislators; health care benefits for legislators; modify, and modify salaries and expense allowances of members of the legislature. Amends sec. 12, art. IV & adds sec. 55, art. IV of the state constitution.Last Action: printed joint resolution filed 09/28/2012",https://www.legislature.mi.gov/Bills/Bill?ObjectName=2012-HJR-BBB,FALSE
12hjr0CCC,HJR CCC of 2012,NA,NA,2011-2012,HJR,Legislature,other,Legislature; other; limitations on when tax or appropriations bills may be reported out of committee or passed out of the legislature; provide for. Amends sec. 26 of art. IV of the state constitution.Last Action: printed joint resolution filed 11/30/2012,https://www.legislature.mi.gov/Bills/Bill?ObjectName=2012-HJR-CCC,FALSE
12hjr0DDD,HJR DDD of 2012,NA,NA,2011-2012,HJR,Education,school districts,"Education; school districts; maintenance of certain specified types of schools; require in each district, and require high-quality free and safe quality public education in this state. Amends sec. 2, art. VIII of the state constitution.Last Action: printed joint resolution filed 12/07/2012",https://www.legislature.mi.gov/Bills/Bill?ObjectName=2012-HJR-DDD,FALSE
